{
  "operation_id": "OP-SP-01-B01-T01-EXAMPLE",
  "task_id": "SP-01-B01-T01",
  "run_id": "RUN-001",
  "type": "DATABASE_MIGRATION",
  "status": "COMPLETED",
  "command": "npx prisma migrate deploy",
  "result_checksum": "sha256:example",
  "result_summary": "Migration applied successfully.",
  "recorded_at": "2026-08-02T10:00:00Z",
  "revision": 2,
  "actor": "executor-01"
}
